{
  "version": "1.0.0",
  "type": "php",
  "tag": "content-exporter",
  "meta": {
    "entity": "content-exporter"
  },
  "data": {
    "posts": [
      {
        "wp:status": "publish",
        "wp:post_type": "page",
        "wp:post_name": "page-with-image",
        "wp:post_id": 3,
        "wp:post_content": "<!-- wp:paragraph -->\n<p>Hello world</p>\n<!-- /wp:paragraph -->\n<!-- wp:image --><figure class=\"wp-block-image\"><img src=\"./wes-walker-unsplash.jpg\"/></figure><!-- /wp:image -->",
        "title": "A page with an image block"
      }
    ]
  }
}
