{
  "version": "1.0.0",
  "type": "php",
  "tag": "content-exporter",
  "meta": {
    "entity": "content-exporter"
  },
  "data": {
    "posts": [
      {
        "wp:status": "publish",
        "wp:post_type": "page",
        "wp:post_name": "hello-world",
        "wp:post_id": 2,
        "wp:post_content": "<!-- wp:paragraph -->\n<p>Hello from import !</p>\n<!-- /wp:paragraph -->",
        "title": "Hello world!"
      }
    ]
  }
}
