{
  "version": "1.0.0",
  "type": "php",
  "tag": "content-exporter",
  "meta": {
    "entity": "content-exporter"
  },
  "data": {
    "posts": [
      {
        "wp:status": "publish",
        "wp:post_type": "page",
        "wp:post_name": "page-with-custom-html-including-media",
        "wp:post_id": 5,
        "wp:post_content": "<!-- wp:paragraph -->\n<p>Hello world</p>\n<!-- /wp:paragraph -->\n\n<!-- wp:html -->\n<p>A bit of custom html utilizing the Gutenberg html block</p>\n<ul>\n  <li>hi</li>\n  <li>ho</li>\n  <li>howdy</li>\n</ul>\n<figure class=\"wp-block-image\">\n<img src=\"http://localhost:8889/wp-content/uploads/2022/03/greysen-johnson-unsplash.jpg\" alt=\"\">     <figcaption>Fly fishing</figcaption>\n</figure>\n<!-- /wp:html -->",
        "title": "A page using Gutenberg HTML block."
      }
    ]
  }
}
